{
  "id": "f8fd3e4e-da1c-43a7-892f-1410ac13e38a",
  "is_private": false,
  "customer_name": "Acme BV",
  "address_street": "Dam 1",
  "address_postal_code": "1012 JS",
  "address_city": "Amsterdam",
  "address_country_code": "NL",
  "address_country_name": "Nederland",
  "address_extra_information": null,
  "shift_vat": false,
  "vat_number": "NL000099998B57",
  "coc_number": "41202536",
  "initials": null,
  "first_name": null,
  "last_name": null,
  "date_of_birth": null,
  "citizen_service_number": null,
  "attn": null,
  "phonenumber": "+31201234567",
  "website": "https://example.com",
  "email": "finance@example.com",
  "cc_emails": [
    "controller@example.com"
  ],
  "email_salutation": "Geachte heer,",
  "additional_information": null,
  "payment_term": 30,
  "invoice_language": "nl",
  "payment_method_invoice": "pay_later",
  "reference": null,
  "mollie_direct_debit_status": null,
  "mollie_customer_id": null,
  "mollie_mandate_id": null,
  "default_ledger_account_id": "61a5b600-16bc-013d-3d2d-42742b204134",
  "archived": false,
  "default_label_id": null,
  "default_discount_description": null,
  "default_discount_percentage": null,
  "peppol_scheme_code": null,
  "peppol_identifier": null
}
